Symbol,Name,Last Sale,Net Change,% Change,Market Cap,Country,IPO Year,Volume,Sector,Industry
RDS/B,Royal Dutch Shell PLC,$49.14,-0.49,-0.987%,,Netherlands,,2434679,,
RDW,Redwire Corporation Common Stock,$11.24,0.34,3.119%,670592709.00,United States,2021,1205074,Capital Goods,Aerospace
RDY,Dr. Reddy's Laboratories Ltd Common Stock,$61.55,-1.54,-2.441%,10209137855.00,India,,179839,Health Care,Biotechnology: Pharmaceutical Preparations
RE,Everest Re Group Ltd. Common Stock,$279.58,0.57,0.204%,11147639381.00,Bermuda,,142053,Finance,Property-Casualty Insurers
RELX,RELX PLC PLC American Depositary Shares (Each representing One Ordinary Share),$31.20,0.54,1.761%,60355667362.00,United Kingdom,2015,471724,Consumer Services,Publishing
RENN,Renren Inc. American Depositary Shares each representing fifteen Class A ordinary shares,$25.00,0.01,0.04%,600483900.00,China,2011,492140,Technology,EDP Services
RERE,AiHuiShou International Co. Ltd. American Depositary Shares (every three of which representing two Class A ordinary shares),$9.35,0.21,2.298%,2081635717.00,,2021,609503,,
RES,RPC Inc. Common Stock,$5.48,-0.03,-0.544%,1182175389.00,United States,,876494,Energy,Oilfield Services/Equipment
REV,Revlon Inc. New Common Stock,$10.26,-0.05,-0.485%,550477287.00,United States,1996,44518,Consumer Non-Durables,Package Goods/Cosmetics
REVG,REV Group Inc. Common Stock,$14.90,-0.13,-0.865%,964736200.00,United States,2017,195950,Capital Goods,Industrial Machinery/Components
REX,REX American Resources Corporation,$85.40,-0.58,-0.675%,509918105.00,United States,,10055,Basic Industries,Automotive Aftermarket
REXR,Rexford Industrial Realty Inc. Common Stock,$65.30,1.47,2.303%,9423810182.00,United States,2013,1735607,Consumer Services,Real Estate Investment Trusts
REXR^B,Rexford Industrial Realty Inc. 5.875% Series B Cumulative Redeemable Preferred Stock,$26.01,-0.07,-0.268%,,United States,,12333,,
REXR^C,Rexford Industrial Realty Inc. 5.625% Series C Cumulative Redeemable Preferred Stock par value $0.01 per share,$26.64,0.04,0.15%,,United States,,43155,,
REZI,Resideo Technologies Inc. Common Stock ,$25.71,0.28,1.101%,3706943413.00,,2018,628464,Miscellaneous,Diversified Manufacture
RF,Regions Financial Corporation Common Stock,$23.28,-0.24,-1.02%,22221675067.00,United States,,10913485,Finance,Major Banks
RF^B,Regions Financial Corporation Depositary Shares Representing 1/40th Perpetual Preferred Series B,$28.4902,0.0674,0.237%,,United States,,19593,,
RF^C,Regions Financial Corporation Depositary Shares each Representing a 1/40th Interest in a  Share of 5.700% Fixed-to-Floating Rate Non-Cumulative  Perpetual Preferred Stock Series C,$29.28,0.17,0.584%,,United States,,36845,,
RF^E,Regions Financial Corporation Depositary Shares Each Representing a 1/40th Interest in a Share of 4.45% Non-Cumulative Perpetual Preferred Stock Series E,$25.85,-0.04,-0.154%,,United States,,47370,,
RFI,Cohen & Steers Total Return Realty Fund Inc. Common Stock,$17.13,-0.18,-1.04%,450021014.00,United States,1993,24071,Finance,Investment Managers
RFL,Rafael Holdings Inc. Class B Common Stock,$31.31,0.05,0.16%,646876560.00,United States,2018,138209,Health Care,Biotechnology: Pharmaceutical Preparations
RFM,RiverNorth Flexible Municipal Income Fund Inc. Common Stock,$23.03,-0.24,-1.031%,140821518.00,,2020,18192,Finance,Trusts Except Educational Religious and Charitable
RFMZ,RiverNorth Flexible Municipal Income Fund II Inc. Common Stock,$20.37,-0.13,-0.634%,496045270.00,,2021,74997,Finance,Trusts Except Educational Religious and Charitable
RFP,Resolute Forest Products Inc. Common Stock,$13.48,-0.19,-1.39%,1066148257.00,Canada,,581383,Basic Industries,Paper
RGA,Reinsurance Group of America Incorporated Common Stock,$119.33,-1.04,-0.864%,8114074492.00,United States,,266828,Finance,Life Insurance
RGR,Sturm Ruger & Company Inc. Common Stock,$79.61,0.32,0.404%,1400865326.00,United States,,66469,,
RGS,Regis Corporation Common Stock,$2.90,0.06,2.113%,104047757.00,United States,1991,1158502,,
RGT,Royce Global Value Trust Inc. Common Stock,$15.79,-0.04,-0.253%,88436506.00,,2013,4890,Finance,Trusts Except Educational Religious and Charitable
RH,RH Common Stock,$672.41,-6.06,-0.893%,14398689862.00,United States,2012,239141,Consumer Services,Other Specialty Stores
RHI,Robert Half International Inc. Common Stock,$110.66,1.41,1.291%,12390604737.00,United States,,630728,Technology,Diversified Commercial Services
RHP,Ryman Hospitality Properties Inc. (REIT),$84.13,1.01,1.215%,4632655635.00,United States,,197988,Consumer Services,Real Estate Investment Trusts
RIG,Transocean Ltd (Switzerland) Common Stock,$3.91,-0.19,-4.634%,2545957185.00,Switzerland,,20033291,Energy,Oil & Gas Production
RIO,Rio Tinto Plc Common Stock,$65.54,-2.59,-3.802%,106115806332.00,Australia,2002,4762310,Basic Industries,Steel/Iron Ore
RIV,RiverNorth Opportunities Fund Inc. Common Stock,$17.49,-0.10,-0.569%,226835296.00,,2015,74389,Finance,Finance Companies
RJF,Raymond James Financial Inc. Common Stock,$101.73,0.06,0.059%,47103321957.00,United States,,3253563,Finance,Investment Bankers/Brokers/Service
RKLY,Rockley Photonics Holdings Limited Ordinary Shares,$7.20,0.20,2.857%,912007037.00,,,657045,,
RKT,Rocket Companies Inc. Class A Common Stock,$16.90,-0.08,-0.471%,2339063225.00,United States,2020,2146055,Finance,Finance: Consumer Services
RKTA,Rocket Internet Growth Opportunities Corp. Class A Ordinary Shares,$9.76,0.00,0.00%,325740000.00,,2021,2,,
RL,Ralph Lauren Corporation Common Stock,$121.49,2.81,2.368%,8930651174.00,United States,1997,897508,Consumer Non-Durables,Apparel
RLGY,Realogy Holdings Corp. Common Stock,$19.62,-1.03,-4.988%,2287382024.00,United States,2012,1570480,Finance,Real Estate
RLI,RLI Corp. Common Stock (DE),$107.37,0.82,0.77%,4855909500.00,United States,,104557,Finance,Property-Casualty Insurers
RLJ,RLJ Lodging Trust Common Shares of Beneficial Interest $0.01 par value,$14.70,0.34,2.368%,2449293053.00,United States,2011,2999617,Consumer Services,Real Estate Investment Trusts
RLJ^A,RLJ Lodging Trust $1.95 Series A Cumulative Convertible  Preferred Shares,$29.00,-0.005,-0.017%,,United States,,7219,,
RLX,RLX Technology Inc. American Depositary Shares each representing the right to receive one (1) Class A ordinary share,$5.63,-0.35,-5.853%,8843550909.00,,2021,7535533,Consumer Non-Durables,Farming/Seeds/Milling
RM,Regional Management Corp. Common Stock,$55.67,-3.04,-5.178%,573032854.00,United States,2012,77842,Finance,Finance: Consumer Services
RMAX,RE/MAX Holdings Inc. Class A Common Stock,$32.12,0.30,0.943%,606779530.00,,2013,79244,Finance,Real Estate
RMD,ResMed Inc. Common Stock,$263.04,1.59,0.608%,38327878520.00,United States,,584123,Health Care,Medical/Dental Instruments
RMI,RiverNorth Opportunistic Municipal Income Fund Inc. Common Stock,$22.31,-0.16,-0.712%,142187609.00,,2018,8335,Finance,Finance/Investors Services
RMM,RiverNorth Managed Duration Municipal Income Fund Inc. Common Stock,$19.58,-0.17,-0.861%,386499743.00,,2019,21588,Finance,Trusts Except Educational Religious and Charitable
RMO,Romeo Power Inc. Class A Common Stock,$4.88,-0.01,-0.204%,654196306.00,,2019,3390832,Capital Goods,Automotive Aftermarket
RMPL^,RiverNorth Specialty Finance Corporation 5.875% ,$25.74,-0.03,-0.116%,,,,1080,,
RMT,Royce Micro-Cap Trust Inc. Common Stock,$11.79,0.00,0.00%,522608633.00,United States,,84434,Finance,Investment Managers
RNG,RingCentral Inc. Class A Common Stock,$248.14,6.68,2.767%,22707293633.00,,2013,667542,Technology,EDP Services
RNGR,Ranger Energy Services Inc. Class A Common Stock,$10.20,-0.11,-1.067%,182546483.00,United States,2017,11781,Energy,Oilfield Services/Equipment
RNP,Cohen & Steers REIT and Preferred and Income Fund Inc. Common Shares,$27.00,0.07,0.26%,1284934158.00,United States,2003,55147,Finance,Investment Managers
RNR,RenaissanceRe Holdings Ltd. Common Stock,$148.00,0.65,0.441%,6971597572.00,Bermuda,,393511,Finance,Property-Casualty Insurers
RNR^F,RenaissanceRe Holdings Ltd. Depositary Shares each Representing a 1/1000th Interest in a 5.750% Series F Preference Share,$26.83,-0.05,-0.186%,,Bermuda,,8181,,
RNR^G,RenaissanceRe Holdings Ltd. Depositary Shares each representing a 1/1000th interest in a share of 4.20% Series G Preference Shares,$25.15,-0.02,-0.079%,,Bermuda,,73270,,
ROG,Rogers Corporation Common Stock,$193.21,1.96,1.025%,3618657526.00,United States,,42451,Capital Goods,Industrial Machinery/Components
ROK,Rockwell Automation Inc. Common Stock,$317.70,-1.70,-0.532%,36861371879.00,United States,,493767,Capital Goods,Industrial Machinery/Components
ROL,Rollins Inc. Common Stock,$38.59,0.16,0.416%,18989339801.00,United States,,928837,Technology,Industrial Specialties
RONI,Rice Acquisition Corp. II Class A Ordinary Shares,$9.87,0.02,0.203%,340539675.00,,2021,140065,,
ROP,Roper Technologies Inc. Common Stock,$481.24,6.30,1.326%,50734170687.00,United States,1992,418078,Capital Goods,Office Equipment/Supplies/Services
ROSS,Ross Acquisition Corp II Class A Ordinary Shares,$9.76,0.00,0.00%,420900000.00,,2021,3909,,
RPAI,Retail Properties of America Inc. Class A Common Stock,$13.15,-0.43,-3.166%,2824591977.00,United States,2012,52727603,Consumer Services,Real Estate Investment Trusts
RPM,RPM International Inc. Common Stock,$87.81,2.23,2.606%,11390336144.00,United States,,1037278,Basic Industries,Paints/Coatings
RPT,RPT Realty Common Stock,$13.57,-0.29,-2.092%,1101523065.00,United States,,343750,Consumer Services,Real Estate Investment Trusts
RPT^D,RPT Realty 7.25% ,$59.64,-0.12,-0.201%,,United States,,535,,
RQI,Cohen & Steers Quality Income Realty Fund Inc Common Shares,$16.31,-0.10,-0.609%,2189507065.00,United States,2002,248524,Finance,Trusts Except Educational Religious and Charitable
RRC,Range Resources Corporation Common Stock,$23.54,-0.92,-3.761%,5879675511.00,United States,,4751969,Energy,Oil & Gas Production
RRD,R.R. Donnelley & Sons Company Common Stock,$6.50,0.16,2.524%,473200000.00,United States,,900870,Consumer Services,Advertising
RRX,Regal Rexnord Corporation Common Stock,$150.77,1.22,0.816%,10215682484.00,United States,,684227,Consumer Durables,Metal Fabrications
RS,Reliance Steel & Aluminum Co. Common Stock (DE),$148.36,-1.00,-0.67%,9418366959.00,United States,1994,320369,Basic Industries,Steel/Iron Ore
RSF,RiverNorth Specialty Finance Corporation,$19.7101,0.0101,0.051%,89806370.00,,2019,21251,Finance,Investment Managers
RSG,Republic Services Inc. Common Stock,$131.29,1.79,1.382%,41798121682.00,United States,1998,1108595,Public Utilities,Environmental Services
RSI,Rush Street Interactive Inc. Class A Common Stock,$21.18,-0.02,-0.094%,4642179217.00,,2020,847653,Consumer Services,Services-Misc. Amusement & Recreation
RSKD,Riskified Ltd. Class A Ordinary Shares,$19.84,-0.52,-2.554%,3127289880.00,,2021,424850,,
RTX,Raytheon Technologies Corporation Common Stock,$91.61,-0.07,-0.076%,138136711917.00,United States,,4274937,Capital Goods,Military/Government/Technical
RVI,Retail Value Inc. Common Stock ,$27.21,-0.04,-0.147%,574597652.00,United States,2018,140650,Consumer Services,Real Estate Investment Trusts
RVLV,Revolve Group Inc. Class A Common Stock,$74.22,2.44,3.399%,5400550166.00,,2019,774163,Consumer Services,Catalog/Specialty Distribution
RVT,Royce Value Trust Inc. Common Stock,$18.92,0.02,0.106%,1954389305.00,United States,1986,124353,Finance,Trusts Except Educational Religious and Charitable
RWT,Redwood Trust Inc. Common Stock,$13.99,0.00,0.00%,1581645354.00,United States,1995,759574,Consumer Services,Real Estate Investment Trusts
RY,Royal Bank Of Canada Common Stock,$106.97,-0.28,-0.261%,152402206620.00,Canada,,1803107,,
RY^T,Royal Bank Of Canada 6.750% Fixed Rate/Floating Rate Noncumulative First Preferred Shares Series C-2,$28.6846,0.00,0.00%,,Canada,,32,,
RYAM,Rayonier Advanced Materials Inc. Common Stock,$7.45,-0.06,-0.799%,474843280.00,United States,2014,227881,Basic Industries,Industrial Specialties
RYAN,Ryan Specialty Group Holdings Inc. Class A Common Stock,$36.47,-0.89,-2.382%,4008194029.00,,2021,398711,,
RYB,RYB Education Inc. American depositary shares each representing one Class A ordinary share,$2.7676,-0.0124,-0.446%,76347971.00,,2017,58112,Miscellaneous,Other Consumer Services
RYI,Ryerson Holding Corporation Common Stock,$24.41,1.11,4.764%,939164840.00,United States,2014,252559,Capital Goods,Office Equipment/Supplies/Services
RYN,Rayonier Inc. REIT Common Stock,$37.11,0.14,0.379%,5244570824.00,United States,,240611,Consumer Services,Real Estate Investment Trusts
RZA,Reinsurance Group of America Incorporated 6.20% Fixed-to-Floating Rate Subordinated Debentures due 2042,$26.48,-0.12,-0.451%,0.00,United States,,28117,Finance,Life Insurance
RZB,Reinsurance Group of America Incorporated 5.75% Fixed-To-Floating Rate Subordinated Debentures due 2056,$28.605,-0.005,-0.017%,0.00,United States,2016,11316,Finance,Life Insurance
S,SentinelOne Inc. Class A Common Stock,$65.76,3.20,5.115%,17428501953.00,,2021,1483869,Technology,EDP Services
SA,Seabridge Gold Inc. Ordinary Shares (Canada),$17.96,-0.04,-0.222%,1383896952.00,Canada,,241682,,
SAFE,Safehold Inc. Common Stock,$75.99,0.36,0.476%,4297984597.00,United States,2017,156052,Consumer Services,Real Estate Investment Trusts
SAH,Sonic Automotive Inc. Common Stock,$53.25,1.87,3.64%,2221374231.00,United States,1997,409670,Consumer Services,Other Specialty Stores
SAIC,SCIENCE APPLICATIONS INTERNATIONAL CORPORATION Common Stock,$91.10,0.76,0.841%,5244278998.00,,,167302,Technology,EDP Services
SAIL,SailPoint Technologies Holdings Inc. Common Stock,$47.07,0.29,0.62%,4374781446.00,United States,2017,374873,Technology,Computer Software: Prepackaged Software
SAK,Saratoga Investment Corp 7.25% Notes due 2025,$26.08,-0.09,-0.344%,0.00,United States,2020,2004,Finance,Finance Companies
SAM,Boston Beer Company Inc. (The) Common Stock,$517.22,5.70,1.114%,6352390010.00,United States,,466416,Consumer Non-Durables,Beverages (Production/Distribution)
SAN,Banco Santander S.A. Sponsored ADR (Spain),$3.88,-0.07,-1.772%,66987069089.00,Spain,,3542858,Finance,Commercial Banks
SAND          ,Sandstorm Gold Ltd. Ordinary Shares (Canada),$6.53,-0.03,-0.457%,1272635729.00,Canada,,896599,,
SAP,SAP  SE ADS,$139.46,-4.19,-2.917%,164504134756.00,Germany,,1417260,Technology,EDP Services
SAR,Saratoga Investment Corp New,$29.04,-0.26,-0.887%,330034692.00,United States,,27844,Finance,Investment Managers
SAVE,Spirit Airlines Inc. Common Stock,$23.20,0.02,0.086%,2514922920.00,United States,,4378000,Transportation,Air Freight/Delivery Services
SB,Safe Bulkers Inc Common Stock ($0.001 par value),$4.71,-0.05,-1.05%,562790025.00,Monaco,2008,1436951,Transportation,Marine Transportation
SB^C,Safe Bulkers Inc Cumulative Redeemable Perpetual Preferred Series C (Marshall Islands),$25.3498,-0.3752,-1.459%,,Monaco,,7320,,
SB^D,Safe Bulkers Inc Perpetual Preferred Series D (Marshall Islands),$25.32,-0.335,-1.306%,,Monaco,,8063,,
SBBA,Scorpio Tankers Inc. 7.00% Senior Notes due 2025,$24.97,0.12,0.483%,0.00,Monaco,2020,16067,Transportation,Marine Transportation
SBH,Sally Beauty Holdings Inc. (Name to be changed from Sally Holdings Inc.) Common Stock,$16.35,0.58,3.678%,1848096417.00,United States,,777779,Miscellaneous,Diversified Commercial Services
SBI,Western Asset Intermediate Muni Fund Inc Common Stock,$9.65,-0.05,-0.515%,135894340.00,United States,1992,12711,Finance,Finance/Investors Services
SBII,Sandbridge X2 Corp. Class A Common Stock,$9.75,-0.005,-0.051%,290278229.00,,2021,227,,
SBOW,SilverBow Resorces Inc. Common Stock,$27.78,-1.25,-4.306%,409088308.00,,,121145,Energy,Oil & Gas Production
SBR,Sabine Royalty Trust Common Stock,$42.41,-0.70,-1.624%,618310021.00,United States,,49946,Energy,Oil & Gas Production
SBS,Companhia de saneamento Basico Do Estado De Sao Paulo - Sabesp American Depositary Shares (Each repstg 250 Common Shares),$6.45,-0.41,-5.977%,4408638655.00,Brazil,2002,3511716,,
SBSW,D/B/A Sibanye-Stillwater Limited ADS,$14.40,-0.69,-4.573%,10368136354.00,,,3490121,Basic Industries,Precious Metals
SC,Santander Consumer USA Holdings Inc. Common Stock,$41.70,-0.11,-0.263%,12763779611.00,,2014,515534,Finance,Finance Companies
SCCO,Southern Copper Corporation Common Stock,$64.35,-1.35,-2.055%,49747779660.00,United States,,961721,Basic Industries,Precious Metals
SCD,LMP Capital and Income Fund Inc. Common Stock,$14.62,0.03,0.206%,261922899.00,United States,2004,28447,Finance,Trusts Except Educational Religious and Charitable
SCE^G,SCE Trust II Trust Preferred Securities,$25.1024,0.0134,0.053%,,United States,,11567,,
SCE^H,SCE Trust III Fixed/Floating Rate Trust Preference Securities,$25.85,-0.14,-0.539%,,United States,,6682,,
SCE^J,Southern California Edison Company 5.375% Fixed-to-Floating Rate Trust Preference Securities,$25.06,0.00,0.00%,,United States,,14746,,
SCE^K,Southern California Edison Company 5.45% Fixed-to-Floating Rate Trust Preference Securities,$25.8453,0.0353,0.137%,,United States,,4174,,
SCE^L,SCE TRUST VI,$25.04,-0.01,-0.04%,,United States,,9319,,
SCHW,Charles Schwab Corporation (The) Common Stock,$82.24,0.65,0.797%,155269331850.00,United States,,5937528,Finance,Investment Bankers/Brokers/Service
SCHW^D,The Charles Schwab Corporation Depositary Shares each representing 1/40th interest in a share of 5.95% Non-Cumulative Perpetual Preferred Stock Series D,$25.71,-0.01,-0.039%,,United States,,34872,,
SCHW^J,The Charles Schwab Corporation Depositary Shares Each Representing a 1/40th Interest in a Share of 4.450% Non-Cumulative Perpetual Preferred Stock Series J,$26.27,-0.05,-0.19%,,United States,,135794,,
SCI,Service Corporation International Common Stock,$62.95,0.66,1.06%,10549066953.00,United States,,610746,Miscellaneous,Other Consumer Services
SCL,Stepan Company Common Stock,$121.46,-1.23,-1.003%,2728703477.00,United States,,83367,Consumer Non-Durables,Package Goods/Cosmetics
SCM,Stellus Capital Investment Corporation Common Stock,$13.87,0.02,0.144%,270270862.00,United States,2012,59184,Finance,Finance/Investors Services
SCS,Steelcase Inc. Common Stock,$12.63,-0.06,-0.473%,1432495648.00,United States,1998,651793,Consumer Durables,Office Equipment/Supplies/Services
SCU,Sculptor Capital Management Inc. Class A Common Stock,$24.83,-0.81,-3.159%,1442730762.00,United States,,1021892,Finance,Investment Managers
SCVX,SCVX Corp. Class A Ordinary Shares,$9.955,0.015,0.151%,286206250.00,,2020,10615,Finance,Business Services
SCX,L.S. Starrett Company (The) Common Stock,$10.69,-0.31,-2.818%,75981869.00,United States,,28565,Consumer Durables,Home Furnishings
SD,SandRidge Energy Inc. Common Stock,$11.48,-0.64,-5.281%,420039137.00,,2016,701009,Energy,Oil & Gas Production
SDHY,PGIM Short Duration High Yield Opportunities Fund Common Shares,$18.73,-0.03,-0.16%,462126339.00,,2020,76916,Finance,Finance/Investors Services
SE,Sea Limited American Depositary Shares each representing one Class A Ordinary Share,$363.30,2.70,0.749%,200597824308.00,United States,2017,1466855,Technology,Computer Software: Prepackaged Software
SEAH,Sports Entertainment Acquisition Corp. Class A Common Stock,$10.17,0.06,0.593%,572062500.00,United States,2020,697089,,
SEAS,SeaWorld Entertainment Inc. Common Stock,$62.24,1.93,3.20%,4928094798.00,United States,2013,569349,Consumer Services,Movies/Entertainment
SEE,Sealed Air Corporation Common Stock,$59.22,0.22,0.373%,8876653097.00,United States,,675173,Basic Industries,Containers/Packaging
SEM,Select Medical Holdings Corporation Common Stock,$34.27,0.78,2.329%,4611924284.00,United States,2009,438049,Health Care,Hospital/Nursing Management
SEMR,SEMrush Holdings Inc. Class A Common Stock,$25.03,1.03,4.292%,3391485154.00,,2021,220955,Technology,EDP Services
SF,Stifel Financial Corporation Common Stock,$75.66,-0.53,-0.696%,7928247066.00,United States,,582223,Finance,Investment Bankers/Brokers/Service
SF^B,Stifel Financial Corporation Depositary Shares Each Representing 1/1000th  Interest in a Share of 6.25% Non-Cumulative  Preferred Stock Series B,$26.9575,-0.1625,-0.599%,,United States,,2276,,
SF^C,Stifel Financial Corporation Depositary Shares Each Representing 1/1000th Interest in a Share of 6.125% Non Cumulative Preferred Stock Series C,$27.69,-0.24,-0.859%,,United States,,14618,,
SF^D,Stifel Financial Corporation Depositary Shares Each Representing 1/1000th Interest in a Share of 4.50% Non-Cumulative Preferred Stock Series D,$25.48,-0.14,-0.546%,,United States,,12147,,
SFB,Stifel Financial Corporation 5.20% Senior Notes due 2047,$26.90,-0.1116,-0.413%,0.00,United States,2017,5421,Finance,Investment Bankers/Brokers/Service
SFBS,ServisFirst Bancshares Inc. Common Stock,$78.92,-1.03,-1.288%,4278028041.00,United States,,168177,Finance,Major Banks
SFE,Safeguard Scientifics Inc. New Common Stock,$8.51,0.09,1.069%,177040398.00,United States,,67179,Finance,Finance/Investors Services
SFL,SFL Corporation Ltd,$8.37,-0.31,-3.571%,1155252008.00,Bermuda,,794242,Transportation,Marine Transportation
SFUN,Fang Holdings Limited American Depositary Shares (Each representing Four Class A Ordinary Shares HK$1.00 par value),$6.24,0.34,5.763%,56192554.00,China,2010,2870,Technology,EDP Services
SGFY,Signify Health Inc. Class A Common Stock,$17.49,0.05,0.287%,2938851556.00,,2021,423033,Technology,Retail: Computer Software & Peripheral Equipment
SGU,Star Group L.P. Common Stock,$10.80,0.14,1.313%,427742856.00,United States,,37128,Public Utilities,Oil Refining/Marketing
SHAK,Shake Shack Inc. Class A Common Stock,$72.82,-1.14,-1.541%,3062624456.00,United States,2015,935215,Consumer Services,Restaurants
SHG,Shinhan Financial Group Co Ltd American Depositary Shares,$34.15,0.06,0.176%,17641657917.00,South Korea,,52200,Finance,Major Banks
SHI,SINOPEC Shangai Petrochemical Company Ltd. Common Stock,$24.73,0.40,1.644%,2676729079.00,China,,308979,Basic Industries,Major Chemicals
SHLX,Shell Midstream Partners L.P. Common Units representing Limited Partner Interests,$12.41,-0.02,-0.161%,4880723154.00,United States,2014,1318429,Energy,Oilfield Services/Equipment
SHO,Sunstone Hotel Investors Inc. Sunstone Hotel Investors Inc. Common Shares,$12.37,-0.02,-0.161%,2709557667.00,United States,2004,1141090,Consumer Services,Real Estate Investment Trusts
SHO^H,Sunstone Hotel Investors Inc. 6.125% Series H Cumulative Redeemable Preferred Stock,$26.10,-0.02,-0.077%,,United States,,32226,,
SHO^I,Sunstone Hotel Investors Inc. 5.70% Series I Cumulative Redeemable Preferred Stock,$25.09,-0.16,-0.634%,,United States,,14648,,
SHOP,Shopify Inc. Class A Subordinate Voting Shares,$1496.71,9.24,0.621%,186772529601.00,Canada,2015,623099,,
SHPW,Shapeways Holdings Inc. Common Stock,$9.58,-1.25,-11.542%,462680317.00,,2019,5321787,Capital Goods,Industrial Machinery/Components
SHW,Sherwin-Williams Company (The) Common Stock,$306.78,4.90,1.623%,80775925918.00,United States,,970595,Basic Industries,Paints/Coatings
SI,Silvergate Capital Corporation Class A Common Stock,$148.38,0.83,0.563%,3935129744.00,United States,2019,781220,,
SI^A,Silvergate Capital Corporation Depositary Shares Each Representing a 1/40th Interest in a Share of 5.375% Fixed Rate Non-Cumulative Perpetual Preferred Stock Series A,$24.90,0.03,0.121%,,United States,,67444,,
SID,Companhia Siderurgica Nacional S.A. Common Stock,$4.42,-0.20,-4.329%,6100106298.00,Brazil,,5482812,Basic Industries,Steel/Iron Ore
SIG,Signet Jewelers Limited Common Shares,$89.80,1.15,1.297%,4764477741.00,Bermuda,,632930,Consumer Services,Consumer Specialties
SII,Sprott Inc. Common Shares,$39.75,0.47,1.197%,989307580.00,,2020,77562,,
SITC,SITE Centers Corp. Common Stock,$16.42,-0.20,-1.203%,3465280921.00,United States,,1527791,Consumer Services,Real Estate Investment Trusts
SITC^A,SITE Centers Corp. 6.375% Class A Preferred Shares,$25.77,0.0728,0.283%,,United States,,6350,,
SITE,SiteOne Landscape Supply Inc. Common Stock,$217.66,4.60,2.159%,9696450235.00,United States,2016,244752,,
SIX,Six Flags Entertainment Corporation New Common Stock,$45.37,1.04,2.346%,3896049798.00,United States,,1168719,Consumer Services,Movies/Entertainment
SJI,South Jersey Industries Inc. Common Stock,$22.93,0.25,1.102%,2578411980.00,United States,,1232967,Public Utilities,Oil/Gas Transmission
SJIJ,South Jersey Industries Inc. 5.625% Junior Subordinated Notes due 2079,$26.56,-0.12,-0.45%,0.00,United States,2019,4272,Public Utilities,Oil/Gas Transmission
SJIV,South Jersey Industries Inc. Corporate Units,$51.21,0.43,0.847%,0.00,United States,2021,2850,Public Utilities,Oil/Gas Transmission
SJM,J.M. Smucker Company (The) New Common Stock,$121.80,0.04,0.033%,13198067858.00,United States,,399108,Consumer Non-Durables,Packaged Foods
SJR,Shaw Communications Inc. Common Stock,$28.89,-0.24,-0.824%,14410948108.00,Canada,,359938,,
SJT,San Juan Basin Royalty Trust Common Stock,$5.98,0.18,3.103%,278720600.00,United States,,438393,Energy,Oil & Gas Production
SJW,SJW Group Common Stock (DE),$68.41,-0.20,-0.292%,2038955056.00,United States,,57916,Public Utilities,Water Supply
SKIL,Skillsoft Corp. Class A Common Stock,$12.30,-0.22,-1.757%,1636625958.00,,2019,173414,Miscellaneous,Diversified Commercial Services
SKLZ,Skillz Inc. Class A Common Stock,$9.94,0.75,8.161%,4003002447.00,,2020,22845767,Technology,EDP Services
SKM,SK Telecom Co. Ltd. Common Stock,$27.91,-0.12,-0.428%,17892734625.00,South Korea,,459509,Public Utilities,Telecommunications Equipment
SKT,Tanger Factory Outlet Centers Inc. Common Stock,$17.54,-0.58,-3.201%,1823410375.00,United States,1993,714171,Consumer Services,Real Estate Investment Trusts
SKX,Skechers U.S.A. Inc. Common Stock,$45.67,1.51,3.419%,7116855113.00,United States,1999,1743052,Consumer Non-Durables,Shoe Manufacturing
SKY,Skyline Champion Corporation Common Stock,$63.81,0.23,0.362%,3621690779.00,United States,,203635,Basic Industries,Homebuilding
SLAC,Social Leverage Acquisition Corp I Class A Common Stock,$9.73,0.00,0.00%,419606250.00,,2021,8973,,
