Symbol,Name,Last Sale,Net Change,% Change,Market Cap,Country,IPO Year,Volume,Sector,Industry
CSPR,Casper Sleep Inc. Common Stock,$4.61,0.09,1.991%,191078751.00,,2020,404485,Miscellaneous,Diversified Commercial Services
CSR,D/B/A Centerspace Common Stock,$101.92,0.17,0.167%,1431452131.00,United States,,27217,Consumer Services,Building operators
CSR^C,D/B/A Centerspace 6.625% Series C ,$26.23,0.08,0.306%,,United States,,802,,
CSTA,Constellation Acquisition Corp I Class A Ordinary Shares,$9.75,0.02,0.206%,386343750.00,,2021,4063,Finance,Business Services
CSTM,Constellium SE Ordinary Shares (France),$18.14,-0.02,-0.11%,2570027419.00,Netherlands,2013,1069696,Basic Industries,Metal Fabrications
CSU,Capital Senior Living Corporation Common Stock,$28.99,-0.13,-0.446%,63505465.00,United States,1997,16784,Health Care,Hospital/Nursing Management
CSV,Carriage Services Inc. Common Stock,$44.24,0.25,0.568%,788610030.00,United States,,91094,Miscellaneous,Other Consumer Services
CTA^A,E.I. du Pont de Nemours and Company Preferred Stock,$94.00,0.00,0.00%,,United States,,755,,
CTA^B,E.I. du Pont de Nemours and Company Preferred Stock,$112.4545,-0.2455,-0.218%,,United States,,482,,
CTBB,Qwest Corporation 6.5% Notes due 2056,$25.65,0.00,0.00%,0.00,United States,2016,44531,,
CTDD,Qwest Corporation 6.75% Notes due 2057,$26.23,-0.04,-0.152%,0.00,United States,2017,17185,,
CTK,CooTek (Cayman) Inc. American Depositary Shares each representing 50 Class A Ordinary Shares,$1.18,0.0478,4.222%,77301274.00,,2018,132063,Technology,EDP Services
CTLT,Catalent Inc. Common Stock,$132.31,0.53,0.402%,22606503800.00,United States,2014,879620,Health Care,Biotechnology: Pharmaceutical Preparations
CTO,CTO Realty Growth Inc. Common Stock,$53.37,-1.07,-1.965%,317900540.00,United States,,16893,Consumer Services,Real Estate Investment Trusts
CTO^A,CTO Realty Growth Inc. 6.375% Series A Cumulative Redeemable Preferred Stock,$25.90,0.05,0.193%,,United States,,4104,,
CTOS,Custom Truck One Source Inc. Common Stock,$8.42,0.06,0.718%,2070639538.00,Cayman Islands,2017,242231,Technology,Diversified Commercial Services
CTR,ClearBridge MLP and Midstream Total Return Fund Inc. Common Stock,$27.47,-0.73,-2.589%,195520445.00,United States,2012,29633,Finance,Investment Managers
CTRA,Coterra Energy Inc. Common Stock,$20.78,-0.63,-2.943%,16907940019.00,United States,,8731543,Energy,Oil & Gas Production
CTS,CTS Corporation Common Stock,$32.39,0.03,0.093%,1050296732.00,United States,,149716,Capital Goods,Industrial Machinery/Components
CTT,CatchMark Timber Trust Inc. Class A Common Stock,$8.38,-0.25,-2.897%,409775078.00,United States,2013,648701,Consumer Services,Real Estate Investment Trusts
CTVA,Corteva Inc. Common Stock ,$42.71,-1.42,-3.218%,31357041350.00,,2019,2653325,Basic Industries,Major Chemicals
CUBB,Customers Bancorp Inc 5.375% Subordinated Notes Due 2034,$27.24,0.00,0.00%,0.00,United States,2019,13,Finance,Major Banks
CUBE,CubeSmart Common Shares,$52.70,-0.04,-0.076%,10633284639.00,United States,,588095,Consumer Services,Real Estate Investment Trusts
CUBI,Customers Bancorp Inc Common Stock,$47.70,0.50,1.059%,1544237654.00,United States,,216160,Finance,Major Banks
CUBI^E,Customers Bancorp Inc Fixed-to-Floating Rate Non-Cumulative Perpetual Preferred Stock Series E,$25.18,0.05,0.199%,,United States,,9223,,
CUBI^F,Customers Bancorp Inc Fixed-to-Floating Rate Non-Cumulative Perpetual Preferred Stock Series F,$25.28,0.02,0.079%,,United States,,4070,,
CUK,Carnival Plc ADS ADS,$20.69,0.08,0.388%,24099507500.00,United States,,1355642,,
CULP,Culp Inc. Common Stock,$13.19,0.52,4.104%,160961316.00,United States,,33955,Basic Industries,Textiles
CURO,CURO Group Holdings Corp. Common Stock,$18.32,-0.48,-2.553%,758991023.00,,2017,79395,Finance,Diversified Financial Services
CURV,Torrid Holdings Inc. Common Stock,$15.64,0.58,3.851%,1721658207.00,,2021,837239,Consumer Services,Clothing/Shoe/Accessory Stores
CUZ,Cousins Properties Incorporated Common Stock,$40.07,-0.57,-1.403%,5957929603.00,United States,,402294,Consumer Services,Real Estate Investment Trusts
CVA,Covanta Holding Corporation Common Stock,$20.17,-0.01,-0.05%,2682795201.00,United States,,479799,,
CVE,Cenovus Energy Inc Common Stock,$11.63,-0.01,-0.086%,23464827560.00,Canada,,9975224,,
CVEO,Civeo Corporation (Canada) Common Shares,$22.82,0.21,0.929%,326697373.00,,2014,31045,,
CVI,CVR Energy Inc. Common Stock,$20.94,-0.68,-3.145%,2105110743.00,United States,2007,485741,Energy,Integrated oil Companies
CVII,Churchill Capital Corp VII Class A Common Stock,$9.76,0.02,0.205%,1683600000.00,,2021,23681,,
CVNA,Carvana Co. Class A Common Stock,$301.76,12.73,4.404%,25499338910.00,United States,2017,968241,Consumer Services,Other Specialty Stores
CVS,CVS Health Corporation Common Stock,$86.86,0.31,0.358%,114618262264.00,United States,,5347204,Health Care,Managed Health Care
CVX,Chevron Corporation Common Stock,$111.74,-1.42,-1.255%,216095320623.00,United States,,9370701,Energy,Integrated oil Companies
CW,Curtiss-Wright Corporation Common Stock,$132.30,0.98,0.746%,5408953068.00,United States,,191567,Capital Goods,Industrial Machinery/Components
CWAN,Clearwater Analytics Holdings Inc. Class A Common Stock,$26.25,0.79,3.103%,4539933405.00,,2021,309278,Technology,Computer Software: Prepackaged Software
CWEN,Clearway Energy Inc. Class C Common Stock,$31.72,0.15,0.475%,3690949097.00,United States,2015,440420,Public Utilities,Electric Utilities: Central
CWH,Camping World Holdings Inc. Class A Commom Stock,$37.22,-1.13,-2.947%,3259336529.00,United States,2016,1172018,Consumer Services,Other Specialty Stores
CWK,Cushman & Wakefield plc Ordinary Shares,$18.26,0.09,0.495%,4076515145.00,,2018,543422,Finance,Real Estate
CWT,California Water Service Group Common Stock,$59.09,-0.97,-1.615%,3045203150.00,United States,,340755,Public Utilities,Water Supply
CX,Cemex S.A.B. de C.V. Sponsored ADR,$6.90,-0.27,-3.766%,10162989797.00,Mexico,,12967292,Capital Goods,Building Materials
CXE,MFS High Income Municipal Trust Common Stock,$5.08,-0.05,-0.975%,160140233.00,United States,1989,101797,Finance,Investment Managers
CXH,MFS Investment Grade Municipal Trust Common Stock,$9.84,-0.0494,-0.50%,89644811.00,United States,1989,26854,Finance,Investment Managers
CXM,Sprinklr Inc. Class A Common Stock,$17.76,0.81,4.779%,4529399826.00,,2021,296702,Technology,Computer Software: Prepackaged Software
CXP,Columbia Property Trust Inc. Common Stock,$19.14,-0.01,-0.052%,2199161750.00,United States,2013,628588,Consumer Services,Real Estate Investment Trusts
CXW,CoreCivic Inc. Common Stock,$9.16,-0.07,-0.758%,1101808447.00,United States,,476785,Consumer Services,Real Estate Investment Trusts
CYD,China Yuchai International Limited Common Stock,$13.15,-0.20,-1.498%,537286514.00,Singapore,1994,15788,Capital Goods,Construction/Ag Equipment/Trucks
CYH,Community Health Systems Inc. Common Stock,$11.38,0.49,4.50%,1503048846.00,United States,2000,1648304,Health Care,Hospital/Nursing Management
CZOO,Cazoo Group Ltd Class A Ordinary Shares,$7.65,0.05,0.658%,5753969218.00,,,448039,Consumer Durables,Automotive Aftermarket
D,Dominion Energy Inc. Common Stock,$77.29,0.70,0.914%,62487985272.00,United States,,3777530,Public Utilities,Electric Utilities: Central
DAC,Danaos Corporation Common Stock,$75.17,-2.46,-3.169%,1548422320.00,Greece,2006,259731,Transportation,Marine Transportation
DAL,Delta Air Lines Inc. Common Stock,$40.40,0.10,0.248%,25856558247.00,United States,,10672012,Transportation,Air Freight/Delivery Services
DAN,Dana Incorporated Common Stock ,$25.38,0.34,1.358%,3685907375.00,United States,,489431,Capital Goods,Auto Parts:O.E.M.
DAO,Youdao Inc. American Depositary Shares each representing one Class A Ordinary Share,$13.12,0.00,0.00%,1626630143.00,,2019,218579,Consumer Services,Other Consumer Services
DAR,Darling Ingredients Inc. Common Stock,$76.63,-0.71,-0.918%,12419408467.00,United States,,761347,Consumer Non-Durables,Farming/Seeds/Milling
DASH,DoorDash Inc. Class A Common Stock,$218.82,3.14,1.456%,73947248300.00,,2020,903758,Capital Goods,Industrial Machinery/Components
DAVA,Endava plc American Depositary Shares (each representing one Class A Ordinary Share),$149.44,3.36,2.30%,8327336278.00,,2018,197415,Technology,EDP Services
DB,Deutsche Bank AG Common Stock,$13.49,-0.01,-0.074%,27839762257.00,Germany,,3256870,Finance,Commercial Banks
DBD,Diebold Nixdorf Incorporated Common Stock,$10.52,0.07,0.67%,824282050.00,United States,,290542,Technology,EDP Services
DBI,Designer Brands Inc. Class A Common Stock,$13.50,0.47,3.607%,985495235.00,United States,,1218228,Consumer Services,Clothing/Shoe/Accessory Stores
DBL,DoubleLine Opportunistic Credit Fund Common Shares of Beneficial Interest,$19.49,0.00,0.00%,291804553.00,United States,2012,40363,,
DBRG,DigitalBridge Group Inc.,$6.61,0.13,2.006%,3259405007.00,United States,2014,2493421,Consumer Services,Real Estate Investment Trusts
DBRG^H,DigitalBridge Group Inc. 7.125% Series H ,$25.36,0.083,0.328%,,United States,,36530,,
DBRG^I,DigitalBridge Group Inc. 7.15% Series I ,$25.73,0.02,0.078%,,United States,,16687,,
DBRG^J,DigitalBridge Group Inc. 7.125% Series J ,$25.95,-0.05,-0.192%,,United States,,33612,,
DCF,BNY Mellon Alcentra Global Credit Income 2024 Target Term Fund Inc. Common Stock,$9.47,-0.06,-0.63%,141700860.00,,2017,48772,Finance,Finance/Investors Services
DCI,Donaldson Company Inc. Common Stock,$60.24,0.29,0.484%,7445369667.00,United States,,205922,Capital Goods,Pollution Control Equipment
DCO,Ducommun Incorporated Common Stock,$48.64,-0.85,-1.718%,579804462.00,United States,,27831,Capital Goods,Military/Government/Technical
DCP,DCP Midstream  LP Common Units ,$32.94,-0.67,-1.993%,6863463122.00,United States,,355439,Public Utilities,Natural Gas Distribution
DCP^B,DCP Midstream LP 7.875% Series B Fixed-to-Floating Rate Cumulative Redeemable Perpetual Preferred Units,$25.64,-0.01,-0.039%,,United States,,5659,,
DCP^C,DCP Midstream LP 7.95% Series C Fixed-to-Floating Rate Cumulative Redeemable Perpetual Preferred Units,$25.24,0.01,0.04%,,United States,,43484,,
DCUE,Dominion Energy Inc. 2019 Series A Corporate Units,$100.91,0.638,0.636%,0.00,United States,2019,16336,Public Utilities,Electric Utilities: Central
DD,DuPont de Nemours Inc. Common Stock,$72.24,-1.02,-1.392%,37785615430.00,,2017,1459247,Capital Goods,Wholesale Distributors
DDD,3D Systems Corporation Common Stock,$27.98,-0.16,-0.569%,3504090185.00,United States,,1402365,Technology,Computer peripheral equipment
DDF,Delaware Investments Dividend & Income Fund Inc. Common Stock,$11.24,-0.16,-1.404%,85549416.00,United States,1993,3925,Finance,Finance/Investors Services
DDL,Dingdong (Cayman) Limited American Depositary Shares (each two representing three Ordinary Shares),$25.58,1.01,4.111%,6038193098.00,,2021,68091,,
DDS,Dillard's Inc. Common Stock,$221.76,0.85,0.385%,4571193876.00,United States,,213571,Consumer Services,Department/Specialty Retail Stores
DDT,Dillard's Capital Trust I,$27.00,0.22,0.822%,0.00,United States,,1926,Consumer Services,Department/Specialty Retail Stores
DE,Deere & Company Common Stock,$342.93,-1.12,-0.326%,106329382651.00,United States,,876406,Capital Goods,Industrial Machinery/Components
DEA,Easterly Government Properties Inc. Common Stock,$21.47,-0.30,-1.378%,1802305376.00,United States,2015,484213,Consumer Services,Real Estate Investment Trusts
DECK,Deckers Outdoor Corporation Common Stock,$379.69,20.42,5.684%,10503283596.00,United States,1993,501146,Consumer Non-Durables,Shoe Manufacturing
DEI,Douglas Emmett Inc. Common Stock,$33.81,-0.30,-0.88%,5932724278.00,United States,2006,857839,Consumer Services,Real Estate Investment Trusts
DELL,Dell Technologies Inc. Class C Common Stock ,$112.98,1.35,1.209%,86442822740.00,,2018,3712423,Technology,Computer Manufacturing
DEN,Denbury Inc. Common Stock,$78.00,1.01,1.312%,3908576100.00,,2020,538998,Energy,Oil & Gas Production
DEO,Diageo plc Common Stock,$199.69,-1.94,-0.962%,116374625506.00,United Kingdom,,254589,Consumer Non-Durables,Beverages (Production/Distribution)
DESP,Despegar.com Corp. Ordinary Shares,$11.89,-0.51,-4.113%,833481010.00,,2017,186688,Transportation,Other Consumer Services
DEX,Delaware Enhanced Global Dividend Common Shares of Beneficial Interest,$10.17,-0.11,-1.07%,114963022.00,United States,2007,14150,Finance,Finance Companies
DFIN,Donnelley Financial Solutions Inc. Common Stock ,$37.51,-0.34,-0.898%,1260592306.00,,2016,167200,Finance,Investment Managers
DFP,Flaherty & Crumrine Dynamic Preferred and Income Fund Inc. Common Stock,$28.70,-0.23,-0.795%,556000393.00,,2013,26542,Finance,Investment Managers
DFS,Discover Financial Services Common Stock,$124.84,-8.15,-6.128%,37385640050.00,United States,,3792830,Finance,Finance: Consumer Services
DG,Dollar General Corporation Common Stock,$218.94,3.71,1.724%,51080939129.00,United States,2009,1144508,Consumer Services,Department/Specialty Retail Stores
DGX,Quest Diagnostics Incorporated Common Stock,$145.36,-1.49,-1.015%,17760195128.00,United States,,2854573,Health Care,Medical Specialities
DHF,BNY Mellon High Yield Strategies Fund Common Stock,$3.32,0.00,0.00%,241389524.00,United States,1998,149269,Finance,Finance Companies
DHI,D.R. Horton Inc. Common Stock,$89.22,-0.30,-0.335%,31958107580.00,United States,,1478862,,
DHR,Danaher Corporation Common Stock,$310.74,-4.08,-1.296%,221837150828.00,United States,,2869669,Health Care,Medical Specialities
DHR^A,Danaher Corporation 4.75% Mandatory Convertible Preferred Stock Series A,$2052.07,-52.71,-2.504%,,United States,,12646,,
DHR^B,Danaher Corporation 5.00% Mandatory Convertible Preferred Stock Series B,$1633.34,0.00,0.00%,,United States,,333,,
DHT,DHT Holdings Inc.,$6.65,-0.24,-3.483%,1116655917.00,Jersey,2005,1875700,Transportation,Marine Transportation
DHX,DHI Group Inc. Common Stock,$4.95,0.05,1.02%,248686837.00,United States,2007,55542,Technology,Diversified Commercial Services
DIAX,Nuveen Dow 30SM Dynamic Overwrite Fund Common Shares of Beneficial Interest,$17.45,-0.14,-0.796%,634602632.00,,2014,75364,Finance,Finance Companies
DIDI,DiDi Global Inc. American Depositary Shares (each four representing one Class A Ordinary Share),$9.81,1.19,13.805%,47315998880.00,,2021,81250920,,
DIN,Dine Brands Global Inc. Common Stock,$81.22,-0.63,-0.77%,1395036182.00,United States,,172367,Consumer Services,Restaurants
DIS,Walt Disney Company (The) Common Stock,$171.34,0.79,0.463%,311346470787.00,United States,,7499837,Consumer Services,Movies/Entertainment
DK,Delek US Holdings Inc. Common Stock,$21.35,0.00,0.00%,1581227479.00,United States,2017,1076645,Energy,Integrated oil Companies
DKL,Delek Logistics Partners L.P. Common Units representing Limited Partner Interests,$50.29,-0.70,-1.373%,2185273146.00,United States,2012,13685,Energy,Oil & Gas Production
DKS,Dick's Sporting Goods Inc Common Stock,$123.95,5.00,4.203%,10980469089.00,United States,2002,1267136,Consumer Services,Other Specialty Stores
DLB,Dolby Laboratories Common Stock,$92.33,0.25,0.272%,9361105659.00,United States,2005,146141,Technology,EDP Services
DLNG,Dynagas LNG Partners LP Common Units,$2.98,-0.05,-1.65%,109670696.00,Greece,,76882,,
DLNG^A,Dynagas LNG Partners LP 9.00% Series A Cumulative Redeemable Preferred Units,$25.68,0.09,0.352%,,Greece,,2336,,
DLNG^B,Dynagas LNG Partners LP 8.75% Series B Fixed to Floating Rate Cumulative Redeemable Perpetual Preferred Units liquidation preference $25.00 per Uni,$25.11,-0.0452,-0.18%,,Greece,,5555,,
DLR,Digital Realty Trust Inc. Common Stock,$154.78,1.62,1.058%,43914811245.00,United States,2004,980927,Consumer Services,Real Estate Investment Trusts
DLR^J,Digital Realty Trust Inc. 5.250% Series J Cumulative Redeemable Preferred Stock,$25.999,0.05,0.193%,,United States,,8428,,
DLR^K,Digital Realty Trust Inc. 5.850% Series K Cumulative Redeemable Preferred Stock par value $0.01 per share,$27.45,-0.05,-0.182%,,United States,,7065,,
DLR^L,Digital Realty Trust Inc. 5.200% Series L Cumulative Redeemable Preferred Stock,$27.38,0.03,0.11%,,United States,,22368,,
DLX,Deluxe Corporation Common Stock,$37.93,0.36,0.958%,1613723126.00,United States,,145188,Technology,Advertising
DLY,DoubleLine Yield Opportunities Fund Common Shares of Beneficial Interest,$19.55,-0.04,-0.204%,937339979.00,,2020,75385,Finance,Investment Managers
DM,Desktop Metal Inc. Class A Common Stock,$7.45,0.21,2.901%,1942070172.00,,2019,4890619,Technology,Computer peripheral equipment
DMB,BNY Mellon Municipal Bond Infrastructure Fund Inc. Common Stock,$15.46,-0.29,-1.841%,284347231.00,,2013,17080,Finance,Trusts Except Educational Religious and Charitable
DMO,Western Asset Mortgage Opportunity Fund Inc. Common Stock,$15.82,-0.18,-1.125%,179171293.00,United States,2010,27986,Finance,Trusts Except Educational Religious and Charitable
DMS,Digital Media Solutions Inc. Class A Ordinary Shares,$6.73,0.34,5.321%,418385451.00,United States,2018,67349,Technology,Advertising
DMYQ,dMY Technology Group Inc. IV Class A Common Stock,$9.97,0.03,0.302%,429956250.00,,2021,67983,,
DNA,Ginkgo Bioworks Holdings Inc. Class A Common Stock,$13.21,-0.56,-4.067%,25857108637.00,United States,2021,6179938,Health Care,Biotechnology: Biological Products (No Diagnostic Substances)
DNB,Dun & Bradstreet Holdings Inc. Common Stock,$18.74,0.26,1.407%,8078521356.00,United States,2020,1166718,Technology,EDP Services
DNMR,Danimer Scientific Inc. Common Stock,$15.74,1.17,8.03%,1538302923.00,,2020,4436400,Consumer Non-Durables,Plastic Products
DNOW,NOW Inc. Common Stock,$7.90,-1.52,-16.136%,873414765.00,,2014,5143205,Energy,Metal Fabrications
DNP,DNP Select Income Fund Inc. Common Stock,$10.85,0.00,0.00%,3699593973.00,United States,1987,283585,Finance,Investment Managers
DNZ,D and Z Media Acquisition Corp. Class A Common Stock,$9.75,0.00,0.00%,350390625.00,,2021,20221,,
DOC,Physicians Realty Trust Common Shares of Beneficial Interest,$18.60,-0.20,-1.064%,4043749145.00,United States,2013,2278307,Consumer Services,Real Estate Investment Trusts
DOCN,DigitalOcean Holdings Inc. Common Stock,$95.41,5.06,5.60%,10241323234.00,,2021,1628284,Technology,Retail: Computer Software & Peripheral Equipment
DOCS,Doximity Inc. Class A Common Stock,$67.87,-4.81,-6.618%,12601581852.00,,2021,2765742,Technology,Retail: Computer Software & Peripheral Equipment
DOLE,Dole plc Ordinary Shares,$15.43,0.11,0.718%,1436512077.00,,2021,221936,,Farming/Seeds/Milling
DOMA,Doma Holdings Inc. Common Stock,$5.93,-0.07,-1.167%,1914129792.00,,2021,512135,Finance,Real Estate
DOOR,Masonite International Corporation Ordinary Shares (Canada),$112.98,0.81,0.722%,2721842305.00,Canada,,77184,,
DOV,Dover Corporation Common Stock,$169.59,0.74,0.438%,24418357302.00,United States,,499381,Capital Goods,Industrial Machinery/Components
DOW,Dow Inc. Common Stock ,$59.26,-0.63,-1.052%,44194436157.00,,2019,8913911,Basic Industries,Industrial Specialties
DPG,Duff & Phelps Utility and Infrastructure Fund Inc.,$14.18,-0.10,-0.70%,537844649.00,United States,2011,70582,Finance,Trusts Except Educational Religious and Charitable
DPZ,Domino's Pizza Inc Common Stock,$467.96,9.38,2.045%,17015185642.00,United States,2004,456955,Consumer Non-Durables,Food Distributors
DQ,DAQO New Energy Corp. American Depositary Shares each representing five ordinary shares,$72.41,-0.35,-0.481%,5323118328.00,China,2010,1449102,Technology,Semiconductors
DRD,DRDGOLD Limited American Depositary Shares,$9.23,-0.07,-0.753%,789270028.00,South Africa,,154566,Basic Industries,Precious Metals
DRE,Duke Realty Corporation Common Stock,$55.19,0.33,0.602%,20880607283.00,United States,,1534810,Consumer Services,Real Estate Investment Trusts
DRH,Diamondrock Hospitality Company Common Stock,$9.36,0.09,0.971%,1971401702.00,United States,2005,1615627,Consumer Services,Real Estate Investment Trusts
DRH^A,Diamondrock Hospitality Company 8.250% Series A Cumulative Redeemable Preferred Stock,$28.31,-0.48,-1.667%,,United States,,15083,,
DRI,Darden Restaurants Inc. Common Stock,$145.62,2.43,1.697%,18899292137.00,United States,,1107134,Consumer Services,Restaurants
DRQ,Dril-Quip Inc. Common Stock,$24.92,-0.41,-1.619%,882943261.00,United States,1997,226981,Energy,Metal Fabrications
DS,Drive Shack Inc.,$2.67,-0.07,-2.555%,245868069.00,United States,,1911591,Consumer Services,Movies/Entertainment
DS^B,Drive Shack Inc. Preferred Series B,$25.82,-0.28,-1.073%,,United States,,2107,,
DS^C,Drive Shack Inc. Preferred Series C,$25.3611,-0.1389,-0.545%,,United States,,100,,
DSL,DoubleLine Income Solutions Fund Common Shares of Beneficial Interests,$17.66,-0.18,-1.009%,1801263982.00,,2013,320224,Finance,Trusts Except Educational Religious and Charitable
DSM,BNY Mellon Strategic Municipal Bond Fund Inc. Common Stock,$7.97,-0.08,-0.994%,393889443.00,United States,1989,116026,Finance,Investment Managers
DSU,Blackrock Debt Strategies Fund Inc. Common Stock,$11.51,-0.02,-0.173%,536271699.00,United States,1998,31707,Finance,Finance Companies
DSX,Diana Shipping inc. common stock,$5.28,-0.25,-4.521%,483304811.00,Greece,2005,822756,Transportation,Marine Transportation
DSX^B,Diana Shipping Inc. Perpetual Preferred Shares Series B (Marshall Islands),$26.05,0.00,0.00%,,Greece,,1,,
DT,Dynatrace Inc. Common Stock,$77.75,1.17,1.528%,22103263479.00,United States,2019,895547,Technology,EDP Services
DTB,DTE Energy Company 2020 Series G 4.375% Junior Subordinated Debentures due 2080,$25.72,-0.05,-0.194%,0.00,United States,2020,18077,Public Utilities,Electric Utilities: Central
DTE,DTE Energy Company Common Stock,$115.40,-0.07,-0.061%,22358929332.00,United States,,788649,Public Utilities,Electric Utilities: Central
DTF,DTF Tax-Free Income Inc. Common Stock,$14.3182,-0.0218,-0.152%,100650746.00,United States,1991,13289,Finance,Investment Managers
DTLA^,Brookfield DTLA Inc. 7.625% Series A Cumulative Redeemable Preferred Stock,$13.85,-0.15,-1.071%,,,,3264,,
DTM,DT Midstream Inc. Common Stock ,$49.69,-0.54,-1.075%,4806636236.00,,2021,483256,Public Utilities,Oil & Gas Production
DTP,DTE Energy Company 6.25% Corporate Units,$50.42,0.06,0.119%,0.00,United States,,22269,Public Utilities,Electric Utilities: Central
DTW,DTE Energy Company 2017 Series E 5.25% Junior Subordinated Debentures due 2077,$26.12,-0.08,-0.305%,0.00,United States,2017,28829,Public Utilities,Electric Utilities: Central
DTY,DTE Energy Company 2016 Series F 6.00% Junior Subordinated Debentures due 2076,$25.4089,-0.0311,-0.122%,0.00,United States,2016,4333,,
DUK,Duke Energy Corporation (Holding Company) Common Stock,$103.00,0.77,0.753%,79241772594.00,United States,,2057828,Public Utilities,Power Generation
DUK^A,Duke Energy Corporation Depositary Shares each representing a 1/1000th interest in a share of 5.75% Series A Cumulative Redeemable Perpetual Preferred Stock,$27.7699,-0.0301,-0.108%,,United States,,65457,,
DUKB,Duke Energy Corporation 5.625% Junior Subordinated Debentures due 2078,$27.45,0.01,0.036%,0.00,United States,2018,16532,Public Utilities,Power Generation
DV,DoubleVerify Holdings Inc. Common Stock,$36.01,0.52,1.465%,5684221856.00,,2021,360573,Technology,Computer Software: Prepackaged Software
DVA,DaVita Inc. Common Stock,$115.41,1.30,1.139%,12087513206.00,United States,,506823,Health Care,Medical/Nursing Services
DVD,Dover Motorsports Inc. Common Stock,$2.41,-0.03,-1.23%,87833874.00,United States,1996,12817,Consumer Services,Services-Misc. Amusement & Recreation
DVN,Devon Energy Corporation Common Stock,$39.70,-1.21,-2.958%,26876900000.00,United States,,9921491,Energy,Oil & Gas Production
DWIN,Delwinds Insurance Acquisition Corp. Class A Common Stock,$9.86,-0.01,-0.101%,254277075.00,,2021,1037,,
DX,Dynex Capital Inc. Common Stock,$17.85,-0.23,-1.272%,617458900.00,United States,,561104,Consumer Services,Real Estate Investment Trusts
DX^C,Dynex Capital Inc. 6.900% Series C Fixed-to-Floating Rate Cumulative Redeemable Preferred Stock,$25.69,0.04,0.156%,,United States,,914,,
DXC,DXC Technology Company Common Stock ,$34.97,0.13,0.373%,8809091343.00,,,1409672,Technology,EDP Services
DY,Dycom Industries Inc. Common Stock,$77.19,0.77,1.008%,2328868614.00,United States,,490329,Basic Industries,Water Supply
DYFN,Angel Oak Dynamic Financial Strategies Income Term Trust Common Shares of Beneficial Interest,$20.2402,-0.0598,-0.295%,82074011.00,,2020,9080,Finance,Finance/Investors Services
E,ENI S.p.A. Common Stock,$28.26,-0.52,-1.807%,50293196291.00,Italy,,207227,Energy,Oil & Gas Production
EAF,GrafTech International Ltd. Common Stock,$11.09,-0.05,-0.449%,2970797540.00,United States,2018,828598,Consumer Durables,Metal Fabrications
EAI,Entergy Arkansas LLC First Mortgage Bonds 4.875% Series Due September 1 2066,$25.30,0.00,0.00%,0.00,United States,2016,24577,,
EARN,Ellington Residential Mortgage REIT Common Shares of Beneficial Interest,$12.31,0.01,0.081%,159027252.00,United States,2013,292851,Consumer Services,Real Estate Investment Trusts
EAT,Brinker International Inc. Common Stock,$44.31,0.10,0.226%,2012204125.00,United States,,1594260,Consumer Services,Restaurants
EB,Eventbrite Inc. Class A Common Stock,$20.65,0.40,1.975%,1947449070.00,United States,2018,315538,Technology,EDP Services
EBF,Ennis Inc. Common Stock,$19.04,0.11,0.581%,497352656.00,United States,,42230,Consumer Services,Office Equipment/Supplies/Services
EBR,Centrais Electricas Brasileiras S A American Depositary Shares (Each representing one Common Share),$6.44,-0.45,-6.531%,10103915060.00,,2016,2960190,Public Utilities,Electric Utilities: Central
EBS,Emergent Biosolutions Inc. Common Stock,$50.59,0.82,1.648%,2716719880.00,United States,2006,331613,Health Care,Biotechnology: Pharmaceutical Preparations
EC,Ecopetrol S.A. American Depositary Shares,$15.31,-0.24,-1.543%,31474829778.00,Colombia,,832132,Energy,Oil & Gas Production
ECAT,BlackRock ESG Capital Allocation Trust Common Shares of Beneficial Interest,$20.00,-0.01,-0.05%,0.00,,2021,291024,,
