Symbol,Name,Last Sale,Net Change,% Change,Market Cap,Country,IPO Year,Volume,Sector,Industry
IGD,Voya Global Equity Dividend and Premium Opportunity Fund,$5.96,-0.02,-0.334%,566062109.00,United States,2005,215020,Finance,Trusts Except Educational Religious and Charitable
IGI,Western Asset Investment Grade Defined Opportunity Trust Inc. Common Stock,$21.69,-0.04,-0.184%,235202803.00,United States,2009,13686,Finance,Investment Managers
IGR,CBRE Global Real Estate Income Fund Common Shares of Beneficial Interest,$8.98,0.00,0.00%,1046982636.00,United States,2004,191833,Finance,Finance Companies
IGT,International Game Technology Ordinary Shares,$29.50,-0.18,-0.606%,6053046000.00,United States,2015,1338065,Consumer Services,Movies/Entertainment
IH,iHuman Inc. American depositary shares each representing five Class A ordinary shares,$5.16,-0.04,-0.769%,275154296.00,United States,2020,10746,Consumer Services,Other Consumer Services
IHC,Independence Holding Company Common Stock,$48.47,-0.60,-1.223%,709813535.00,United States,,6142,Finance,Life Insurance
IHD,Voya Emerging Markets High Income Dividend Equity Fund Common Shares,$7.40,0.00,0.00%,137102146.00,United States,2011,43429,Finance,Investment Managers
IHG,Intercontinental Hotels Group American Depositary Shares (Each representing one Ordinary Share),$69.53,-0.58,-0.827%,12739030173.00,United Kingdom,,243362,Consumer Services,Hotels/Resorts
IHIT,Invesco High Income 2023 Target Term Fund Common Shares of Beneficial Interest,$9.75,-0.08,-0.814%,234750643.00,United States,2016,27160,Finance,Investment Managers
IHS,IHS Holding Limited Ordinary Shares,$17.08,-0.11,-0.64%,5603160083.00,,2021,267254,,
IHTA,Invesco High Income 2024 Target Term Fund Common Shares of Beneficial Interest No par value per share,$9.835,0.0203,0.207%,86369092.00,,2017,27108,Finance,Finance/Investors Services
IIAC,Investindustrial Acquisition Corp. Class A Ordinary Shares,$10.01,-0.005,-0.05%,503628125.00,United Kingdom,2021,706127,Finance,Business Services
IIF,Morgan Stanley India Investment Fund Inc. Common Stock,$27.79,-0.36,-1.279%,311296994.00,United States,1994,35215,Finance,Trusts Except Educational Religious and Charitable
IIIN,Insteel Industries Inc. Common Stock,$37.51,-0.66,-1.729%,726102488.00,United States,,89992,,
IIM,Invesco Value Municipal Income Trust Common Stock,$16.01,-0.09,-0.559%,753374853.00,United States,,82961,Finance,Investment Managers
IIPR,Innovative Industrial Properties Inc. Common Stock,$256.69,4.01,1.587%,6142156354.00,United States,2016,177374,Consumer Services,Real Estate Investment Trusts
IIPR^A,Innovative Industrial Properties Inc. 9.00% Series A Cumulative Redeemable Preferred Stock,$34.50,-0.40,-1.146%,,United States,,613,,
IMAX,Imax Corporation Common Stock,$20.55,-0.37,-1.769%,1220585930.00,Canada,,570427,,
IMPX,AEA-Bridges Impact Corp. Class A Ordinary Shares,$9.78,0.01,0.102%,489000000.00,,2020,30549,Finance,Business Services
INFO,IHS Markit Ltd. Common Shares,$124.33,1.44,1.172%,49587948527.00,Bermuda,1996,855365,Miscellaneous,Business Services
INFY,Infosys Limited American Depositary Shares,$23.41,-0.72,-2.984%,98096473632.00,India,,6244552,Technology,EDP Services
ING,ING Group N.V. Common Stock,$15.26,-0.05,-0.327%,59456135926.00,Netherlands,1997,2725045,Finance,Commercial Banks
INGR,Ingredion Incorporated Common Stock,$97.16,0.30,0.31%,6510212407.00,United States,,181929,Consumer Non-Durables,Farming/Seeds/Milling
INN,Summit Hotel Properties Inc. Common Stock,$10.09,-0.08,-0.787%,1074037718.00,United States,2011,459134,Consumer Services,Real Estate Investment Trusts
INN^E,Summit Hotel Properties Inc. 6.250% Series E Cumulative Redeemable Preferred Stock,$26.60,0.04,0.151%,,United States,,20189,,
INN^F,Summit Hotel Properties Inc. 5.875% Series F Cumulative Redeemable Preferred Stock $0.01 par value per share,$25.84,0.04,0.155%,,United States,,1543,,
INS,Intelligent Systems Corporation Common Stock,$41.88,-0.11,-0.262%,366140046.00,United States,1992,18713,Technology,Retail: Computer Software & Peripheral Equipment
INSI,Insight Select Income Fund,$21.13,0.02,0.095%,226303040.00,United States,,19581,Finance,Investment Managers
INSP,Inspire Medical Systems Inc. Common Stock,$256.59,5.05,2.008%,6997619331.00,United States,1998,86169,Health Care,Biotechnology: Electromedical & Electrotherapeutic Apparatus
INST,Instructure Holdings Inc. Common Stock,$25.49,0.37,1.473%,3530365000.00,,2021,55034,Technology,Computer Software: Prepackaged Software
INSW,International Seaways Inc. Common Stock ,$18.42,-0.41,-2.177%,933422319.00,,2016,375527,Transportation,Marine Transportation
INSW^A,International Seaways Inc. 8.50% Senior Notes due June 30 2023,$25.785,0.0185,0.072%,,,,174,,
INT,World Fuel Services Corporation Common Stock,$32.03,0.16,0.502%,2033977196.00,United States,,316462,Energy,Oil Refining/Marketing
INVH,Invitation Homes Inc. Common Stock,$40.30,-0.18,-0.445%,23962784088.00,United States,2017,2777333,Consumer Services,Real Estate Investment Trusts
IO,Ion Geophysical Corporation Common Stock,$2.26,0.07,3.196%,66980700.00,United States,,5056607,Energy,Oilfield Services/Equipment
IONQ,IonQ Inc. Common Stock,$10.18,-0.26,-2.49%,381750000.00,United States,2021,1722676,Capital Goods,Wholesale Distributors
IP,International Paper Company Common Stock,$53.16,-0.37,-0.691%,20776768080.00,United States,,1679547,Basic Industries,Containers/Packaging
IPG,Interpublic Group of Companies Inc. (The) Common Stock,$37.08,-0.93,-2.447%,14595437943.00,United States,,6638342,Technology,Advertising
IPI,Intrepid Potash Inc Common Stock,$45.61,-0.73,-1.575%,613635116.00,United States,2008,185094,Basic Industries,Major Chemicals
IPOD,Social Capital Hedosophia Holdings Corp. IV Class A Ordinary Shares,$10.22,0.10,0.988%,587650000.00,United States,2020,1040219,Finance,Business Services
IPOF,Social Capital Hedosophia Holdings Corp. VI Class A Ordinary Shares,$10.20,0.09,0.89%,1466250000.00,United States,2020,2482833,Finance,Business Services
IPVA,InterPrivate II Acquisition Corp. Class A Common Stock,$9.75,0.001,0.01%,317301563.00,,2021,52190,,
IPVF,InterPrivate III Financial Partners Inc. Class A Common Stock,$9.94,0.02,0.202%,330368325.00,,2021,504143,,
IQI,Invesco Quality Municipal Income Trust Common Stock,$12.97,-0.14,-1.068%,685902847.00,United States,,93485,Finance,Finance Companies
IQV,IQVIA Holdings Inc. Common Stock,$254.84,3.32,1.32%,48830487961.00,United States,2013,1308326,Health Care,Managed Health Care
IR,Ingersoll Rand Inc. Common Stock,$54.11,0.55,1.027%,21928645006.00,United States,2017,2410061,Capital Goods,Industrial Machinery/Components
IRL,New Ireland Fund Inc (The) Common Stock,$12.60,0.00,0.00%,61150345.00,United States,1990,184,Finance,Trusts Except Educational Religious and Charitable
IRM,Iron Mountain Incorporated (Delaware)Common Stock REIT,$45.75,0.21,0.461%,13242809366.00,United States,,975736,Consumer Services,Real Estate Investment Trusts
IRNT,IronNet Inc. Common Stock,$10.27,-0.41,-3.839%,867030033.00,United States,2020,3617380,Technology,EDP Services
IRS,IRSA Inversiones Y Representaciones S.A. Common Stock,$4.72,-0.16,-3.279%,310909798.00,Argentina,,36468,Consumer Services,Homebuilding
IRT,Independence Realty Trust Inc. Common Stock,$22.19,0.17,0.772%,2332317939.00,United States,2013,447556,Consumer Services,Real Estate Investment Trusts
IS,ironSource Ltd. Class A Ordinary Shares,$11.54,-0.03,-0.259%,11710535120.00,,2021,833611,,
ISD,PGIM High Yield Bond Fund Inc.,$16.32,-0.08,-0.488%,542749736.00,United States,2012,76574,Finance,Trusts Except Educational Religious and Charitable
ISOS,Isos Acquisition Corporation Class A Ordinary Shares,$10.04,0.05,0.501%,319820435.00,,2021,1136605,,
IT,Gartner Inc. Common Stock,$319.83,4.67,1.482%,26753379073.00,United States,1993,529608,Finance,Diversified Commercial Services
ITCB,Itau CorpBanca American Depositary Shares (each representing 1500 shares of Common Stock no par value),$3.41,-0.03,-0.872%,1164871365.00,Chile,,6733,Finance,Commercial Banks
ITGR,Integer Holdings Corporation Common Stock,$91.96,1.06,1.166%,3034685334.00,United States,,72954,Health Care,Medical/Dental Instruments
ITT,ITT Inc. Common Stock ,$94.47,0.74,0.79%,8133867000.00,United States,2011,272237,Capital Goods,Fluid Controls
ITUB,Itau Unibanco Banco Holding SA American Depositary Shares (Each repstg 500 Preferred shares),$4.30,-0.15,-3.371%,42053514749.00,Brazil,,58873093,Finance,Major Banks
ITW,Illinois Tool Works Inc. Common Stock,$224.53,0.86,0.384%,70719723277.00,United States,,521726,Capital Goods,Industrial Machinery/Components
IVAN,Ivanhoe Capital Acquisition Corp. Class A Ordinary Shares,$9.99,0.05,0.503%,344655000.00,,2021,265878,Finance,Business Services
IVC,Invacare Corporation Common Stock,$4.66,-0.04,-0.851%,163137443.00,United States,,527273,Health Care,Industrial Specialties
IVH,Delaware Ivy High Income Opportunities Fund,$14.03,-0.01,-0.071%,232480383.00,,2013,42714,Finance,Investment Managers
IVR,INVESCO MORTGAGE CAPITAL INC Common Stock,$3.18,0.01,0.315%,921184817.00,United States,2009,3713189,Consumer Services,Real Estate Investment Trusts
IVR^B,Invesco Mortgage Capital Inc. Preferred Series B Cum Fxd to Fltg,$25.38,-0.07,-0.275%,,United States,,5826,,
IVR^C,INVESCO MORTGAGE CAPITAL INC 7.5% Fixed-to-Floating Series C Cumulative Redeemable Preferred Stock Liquation Preference $25.00 per Share,$25.25,-0.19,-0.747%,,United States,,18106,,
IVT,InvenTrust Properties Corp. Common Stock,$24.61,-0.25,-1.006%,1753742636.00,,2021,823230,Consumer Services,Real Estate Investment Trusts
IVZ,Invesco Ltd Common Stock,$25.00,-0.42,-1.652%,11534794600.00,United States,,2684787,Finance,Investment Managers
IX,Orix Corp Ads Common Stock,$94.72,-1.38,-1.436%,22809186376.00,Japan,,10589,Finance,Diversified Financial Services
J,Jacobs Engineering Group Inc. Common Stock,$136.87,0.46,0.337%,17836133570.00,United States,,383917,Capital Goods,Oilfield Services/Equipment
JATT,JATT Acquisition Corp Class A Ordinary Shares,$9.87,0.00,0.00%,170257500.00,,2021,18,,
JBGS,JBG SMITH Properties Common Shares ,$30.00,-0.36,-1.186%,3958227090.00,United States,2017,586033,Consumer Services,Real Estate Investment Trusts
JBI,Janus International Group Inc. Common Stock,$13.24,-0.14,-1.046%,1832207470.00,,2021,484886,,
JBK,Lehman ABS 3.50 3.50% Adjustable Corp Backed Tr Certs GS Cap I,$33.0365,0.0365,0.111%,0.00,United States,,500,Finance,Trusts Except Educational Religious and Charitable
JBL,Jabil Inc. Common Stock,$62.63,1.69,2.773%,9133309727.00,United States,1993,757044,Technology,Electrical Products
JBT,John Bean Technologies Corporation Common Stock,$151.82,2.92,1.961%,4822889320.00,United States,,95101,Capital Goods,Diversified Manufacture
JCE,Nuveen Core Equity Alpha Fund Nuveen Core Equity Alpha Fund Common Shares of Beneficial Interest,$16.77,-0.14,-0.828%,268811042.00,United States,2007,45736,Finance,Trusts Except Educational Religious and Charitable
JCI,Johnson Controls International plc Ordinary Share,$73.93,0.81,1.108%,52654738359.00,Switzerland,,2084024,Capital Goods,Industrial Machinery/Components
JCO,Nuveen Credit Opportunities 2022 Target Term Fund Common Shares of Beneficial Interest,$8.16,-0.005,-0.061%,226556019.00,United States,2017,54139,Finance,Trusts Except Educational Religious and Charitable
JDD,Nuveen Diversified Dividend and Income Fund Shares of Beneficial Interest,$10.73,0.11,1.036%,211043187.00,United States,2003,24474,Finance,Finance Companies
JEF,Jefferies Financial Group Inc. Common Stock,$42.36,0.31,0.737%,10401970229.00,United States,,1294759,Finance,Finance/Investors Services
JELD,JELD-WEN Holding Inc. Common Stock,$27.09,0.28,1.044%,2495440617.00,United States,2017,466544,,
JEMD,Nuveen Emerging Markets Debt 2022 Target Term Fund Common Shares of Beneficial Interest $0.01 par value per share,$7.89,-0.045,-0.567%,112420555.00,,2017,16638,Finance,Investment Managers
JEQ,Aberdeen Japan Equity Fund Inc.  Common Stock,$9.20,-0.16,-1.709%,123358531.00,United States,1992,57180,Finance,Finance Companies
JFR,Nuveen Floating Rate Income Fund Common Stock,$10.18,-0.03,-0.294%,579430004.00,United States,2004,120651,Finance,Trusts Except Educational Religious and Charitable
JGH,Nuveen Global High Income Fund Common Shares of Beneficial Interest,$15.84,-0.15,-0.938%,367129905.00,United States,2014,51134,Finance,Investment Managers
JHAA,Nuveen Corporate Income 2023 Target Term Fund,$9.945,-0.005,-0.05%,77827661.00,,2018,4042,Finance,Finance/Investors Services
JHB,Nuveen Corporate Income November 2021 Target Term Fund,$9.3996,0.0096,0.102%,525438101.00,,2016,73942,Finance,Investment Managers
JHG,Janus Henderson Group plc Ordinary Shares,$45.38,0.26,0.576%,7741125971.00,,2017,590620,Finance,Investment Managers
JHI,John Hancock Investors Trust Common Stock,$18.58,-0.04,-0.215%,161776525.00,United States,,10275,Finance,Trusts Except Educational Religious and Charitable
JHS,John Hancock Income Securities Trust Common Stock,$15.56,-0.04,-0.256%,181220863.00,United States,,6200,Finance,Finance Companies
JHX,James Hardie Industries plc American Depositary Shares (Ireland),$38.93,0.45,1.169%,17308234476.00,Ireland,,35480,Capital Goods,Building Materials
JILL,J. Jill Inc. Common Stock,$15.25,-0.41,-2.618%,152265089.00,,2017,44845,Consumer Services,Clothing/Shoe/Accessory Stores
JKS,JinkoSolar Holding Company Limited American Depositary Shares (each representing 4 Common Shares),$56.86,2.18,3.987%,2711490098.00,China,2010,1326131,Technology,Semiconductors
JLL,Jones Lang LaSalle Incorporated Common Stock,$254.91,0.59,0.232%,12924362955.00,United States,,133769,Finance,Real Estate
JLS,Nuveen Mortgage and Income Fund,$20.99,-0.01,-0.048%,115181366.00,United States,2009,28305,Finance,Investment Managers
JMIA,Jumia Technologies AG American Depositary Shares each representing two Ordinary Shares,$20.09,0.13,0.651%,1980725013.00,,2019,2896501,Consumer Services,Catalog/Specialty Distribution
JMM,Nuveen Multi-Market Income Fund (MA),$7.47,0.00,0.00%,70683755.00,United States,,79,Finance,Trusts Except Educational Religious and Charitable
JMP,JMP Group LLC Common Shares,$7.4701,-0.0199,-0.266%,149091953.00,United States,2007,10871,Finance,Investment Bankers/Brokers/Service
JNJ,Johnson & Johnson Common Stock,$163.40,-0.38,-0.232%,430147573833.00,United States,,4522056,Health Care,Biotechnology: Pharmaceutical Preparations
JNPR,Juniper Networks Inc. Common Stock,$28.43,-0.12,-0.42%,9244066271.00,United States,1999,1831233,Technology,Computer peripheral equipment
JOBY,Joby Aviation Inc. Common Stock,$8.75,-0.34,-3.74%,5284019510.00,United States,2020,2175580,Transportation,Aerospace
JOE,St. Joe Company (The) Common Stock,$46.79,0.99,2.162%,2755114468.00,United States,,173847,Consumer Services,Homebuilding
JOF,Japan Smaller Capitalization Fund Inc Common Stock,$8.75,-0.11,-1.242%,247921564.00,United States,1990,89736,Finance,Trusts Except Educational Religious and Charitable
JP,Jupai Holdings Limited American Depositary Shares each representing six ordinary shares,$1.13,-0.08,-6.612%,37544447.00,,2015,557055,Consumer Services,Other Consumer Services
JPC,Nuveen Preferred & Income Opportunities Fund,$9.96,0.01,0.101%,1034293790.00,United States,2003,131447,Finance,Investment Managers
JPI,Nuveen Preferred and Income Term Fund Common Shares of Beneficial Interest,$25.32,-0.06,-0.236%,576441779.00,,2012,24868,Finance,Finance Companies
JPM,JP Morgan Chase & Co. Common Stock,$169.50,-1.34,-0.784%,500923350000.00,United States,,8414072,Finance,Major Banks
JPM^C,J P Morgan Chase & Co Depositary Shares each representing a 1/400th interest in a share of 6.00% Non-Cumulative  Preferred Stock Series EE,$27.88,-0.08,-0.286%,,United States,,50535,,
JPM^D,J P Morgan Chase & Co Depositary Shares each representing a 1/400th  interest in a share of 5.75% Non-Cumulative  Preferred Stock Series DD,$27.56,-0.06,-0.217%,,United States,,83600,,
JPM^J,J P Morgan Chase & Co Depositary Shares each representing a 1/400th interest in a share of JPMorgan Chase & Co. 4.75% Non-Cumulative Preferred Stock Series GG,$26.31,0.03,0.114%,,United States,,39214,,
JPM^K,J P Morgan Chase & Co Depositary Shares each representing a 1/400th interest in a share of 4.55% Non-Cumulative Preferred Stock Series JJ,$26.19,-0.02,-0.076%,,United States,,40884,,
JPM^L,J P Morgan Chase & Co Depositary Shares each representing a 1/400th interest in a share of 4.625% Non-Cumulative Preferred Stock Series LL,$26.46,0.03,0.114%,,United States,,60706,,
JPM^M,J P Morgan Chase & Co Depositary Shares each representing a 1/400th interest in a share of 4.20% Non-Cumulative Preferred Stock Series MM,$25.10,-0.10,-0.397%,,United States,,341808,,
JPS,Nuveen Preferred & Income Securities Fund,$9.87,0.02,0.203%,2020986678.00,United States,2002,264500,Finance,Investment Managers
JPT,Nuveen Preferred and Income 2022 Term Fund Common Shares of Beneficial Interest,$24.75,-0.17,-0.682%,169390658.00,United States,2017,3452,Finance,Trusts Except Educational Religious and Charitable
JQC,Nuveen Credit Strategies Income Fund Shares of Beneficial Interest,$6.56,-0.02,-0.304%,889596942.00,United States,2003,264783,Finance,Finance Companies
JRI,Nuveen Real Asset Income and Growth Fund Common Shares of Beneficial Interest,$15.94,0.01,0.063%,437611659.00,United States,2012,26420,Finance,Finance Companies
JRO,Nuveen Floating Rate Income Opportuntiy Fund Shares of Beneficial Interest,$10.07,-0.01,-0.099%,408250065.00,United States,2004,186970,Finance,Investment Managers
JRS,Nuveen Real Estate Income Fund Common Shares of Beneficial Interest,$11.54,0.02,0.174%,333419115.00,United States,2001,55527,Finance,Finance/Investors Services
JSD,Nuveen Short Duration Credit Opportunities Fund Common Shares of Beneficial Interest,$15.21,0.06,0.396%,153402706.00,United States,2011,22469,Finance,Finance Companies
JT,Jianpu Technology Inc. American depositary shares,$1.65,-0.11,-6.25%,34949267.00,,2017,221120,Technology,EDP Services
JTA,Nuveen Tax-Advantaged Total Return Strategy Fund Common Share of Beneficial Interest,$11.61,0.05,0.433%,160808914.00,United States,2004,25519,Finance,Finance Companies
JTD,Nuveen Tax-Advantaged Dividend Growth Fund Common Shares of Beneficial Interest,$16.55,0.17,1.038%,239715827.00,United States,,38667,Finance,Trusts Except Educational Religious and Charitable
JW/A,John Wiley & Sons Inc.,$54.68,1.66,3.131%,,United States,,245043,,
JW/B,John Wiley & Sons Inc.,$53.25,0.28,0.529%,,United States,,382,,
JWN,Nordstrom Inc. Common Stock,$29.28,0.52,1.808%,4653261604.00,United States,,2796163,Consumer Services,Clothing/Shoe/Accessory Stores
JWSM,Jaws Mustang Acquisition Corp. Class A Ordinary Shares,$9.78,0.01,0.102%,1265287500.00,,2021,301054,Finance,Business Services
JXN,Jackson Financial Inc. Class A Common Stock ,$28.79,-0.11,-0.381%,2719628435.00,,2021,666060,Finance,Finance/Investors Services
K,Kellogg Company Common Stock,$61.68,-0.33,-0.532%,21025413883.00,United States,,1658971,Consumer Non-Durables,Packaged Foods
KAHC,KKR Acquisition Holdings I Corp. Class A Common Stock,$9.80,0.01,0.102%,1690500000.00,,2021,381210,,
KAI,Kadant Inc Common Stock,$216.74,2.37,1.106%,2509915306.00,United States,,16404,Technology,Industrial Machinery/Components
KAMN,Kaman Corporation Common Stock,$37.97,0.27,0.716%,1056960486.00,United States,,95810,Capital Goods,Military/Government/Technical
KAR,KAR Auction Services Inc Common Stock,$15.21,0.02,0.132%,1842499048.00,United States,2009,1162191,,
KB,KB Financial Group Inc,$48.42,0.50,1.043%,18866094501.00,South Korea,,106442,Finance,Commercial Banks
KBH,KB Home Common Stock,$40.85,-0.07,-0.171%,3573461308.00,United States,1986,791233,,
KBR,KBR Inc. Common Stock,$43.33,0.50,1.167%,6100159151.00,United States,2006,1182648,Capital Goods,Oilfield Services/Equipment
KCGI,Kensington Capital Acquisition Corp. V Class A Ordinary Shares,$9.81,0.01,0.102%,338445000.00,,2021,10320,,
KEN,Kenon Holdings Ltd. Ordinary Shares,$40.80,-0.20,-0.488%,2198267974.00,Singapore,2015,4369,Public Utilities,Electric Utilities: Central
KEP,Korea Electric Power Corporation Common Stock,$9.82,0.07,0.718%,12608174472.00,South Korea,1994,101242,Consumer Durables,Electrical Products
KEX,Kirby Corporation Common Stock,$56.61,0.83,1.488%,3402770490.00,United States,,450847,Transportation,Marine Transportation
KEY,KeyCorp Common Stock,$23.78,0.06,0.253%,22742481026.00,United States,,9893717,Finance,Major Banks
KEY^I,KeyCorp Depositary Shares Each Representing a 1/40th Ownership Interest in a Share of Fixed-to-Floating Rate Perpetual Non-Cumulative Preferred Stock Series E,$30.31,0.00,0.00%,,United States,,18424,,
KEY^J,KeyCorp Depositary Shares each representing a 1/40th ownership interest in a share of Fixed Rate Perpetual Non-Cumulative Preferred Stock Series F,$26.85,-0.065,-0.242%,,United States,,29976,,
KEY^K,KeyCorp Depositary Shares each representing a 1/40th ownership interest in a share of Fixed Rate Perpetual Non-Cumulative Preferred Stock Series G,$27.19,-0.01,-0.037%,,United States,,28833,,
KEYS,Keysight Technologies Inc. Common Stock,$176.45,2.32,1.332%,32501357556.00,United States,2014,647193,Capital Goods,Industrial Machinery/Components
KF,Korea Fund Inc. (The) New Common Stock,$40.4795,-0.2705,-0.664%,204055095.00,United States,,29792,Finance,Investment Managers
KFS,Kingsway Financial Services Inc. Common Stock (DE),$5.69,-0.04,-0.698%,129251940.00,Canada,,2258,,
KFY,Korn Ferry Common Stock,$72.84,-1.05,-1.421%,3970217768.00,United States,1999,309168,Technology,Diversified Commercial Services
KGC,Kinross Gold Corporation Common Stock,$6.28,0.01,0.159%,7924942625.00,Canada,,8300628,,
KIM,Kimco Realty Corporation Common Stock,$22.86,-0.38,-1.635%,14010672167.00,United States,,3070556,Consumer Services,Real Estate Investment Trusts
KIM^L,Kimco Realty Corporation Class L Depositary Shares each of which represents a one-one thousandth fractional interest in a share of 5.125% Class L Cumulative Redeemable Preferred Stock liquidation preference $25000.00 per share,$25.75,-0.09,-0.348%,,United States,,7367,,
KIM^M,Kimco Realty Corporation Class M Depositary Shares each of which represents a one-one thousandth fractional interest in a share of 5.25% Class M Cumulative Redeemable Preferred Stock liquidation preference $25000.00 per share,$26.24,-0.14,-0.531%,,United States,,48118,,
KIO,KKR Income Opportunities Fund Common Shares,$16.57,0.06,0.363%,337039020.00,,2013,40903,Finance,Investment Managers
KKR,KKR & Co. Inc. Common Stock,$73.12,2.54,3.599%,42631224746.00,United States,,3389611,Finance,Investment Managers
KKR^C,KKR & Co. Inc. 6.00% Series C Mandatory Convertible Preferred Stock,$92.57,3.33,3.732%,,United States,,31781,,
KKRS,KKR Group Finance Co. IX LLC 4.625% Subordinated Notes due 2061,$25.95,-0.09,-0.346%,0.00,,2021,12308,,
KL,Kirkland Lake Gold Ltd. Common Shares,$45.78,0.26,0.571%,12076616131.00,,,772530,,
KLR,Kaleyra Inc. Common Stock,$10.83,0.05,0.464%,447358449.00,United States,2018,146610,Technology,Internet and Information Services
KMB,Kimberly-Clark Corporation Common Stock,$131.28,-0.35,-0.266%,44210126781.00,United States,,978644,Basic Industries,Paper
KMF,Kayne Anderson NextGen Energy & Infrastructure Inc.,$7.74,-0.15,-1.901%,365308356.00,,2010,174293,Finance,Investment Managers
KMI,Kinder Morgan Inc. Common Stock,$17.53,-1.12,-6.005%,39698132680.00,United States,2011,38520286,Public Utilities,Natural Gas Distribution
KMPR,Kemper Corporation,$66.98,1.63,2.494%,4261727753.00,United States,,213342,Finance,Property-Casualty Insurers
KMT,Kennametal Inc. Common Stock,$39.03,-0.35,-0.889%,3272377654.00,United States,,587170,Capital Goods,Industrial Machinery/Components
KMX,CarMax Inc,$141.90,3.34,2.411%,23003865634.00,United States,,664766,Consumer Services,Other Specialty Stores
KN,Knowles Corporation Common Stock,$20.01,0.31,1.574%,1840649825.00,,2014,1669245,Consumer Non-Durables,Consumer Electronics/Appliances
KNOP,KNOT Offshore Partners LP Common Units representing Limited Partner Interests,$20.03,-0.14,-0.694%,672656794.00,United Kingdom,2013,105474,Transportation,Marine Transportation
KNX,Knight-Swift Transportation Holdings Inc.,$56.75,2.43,4.473%,9419135276.00,United States,2017,3123600,Transportation,Trucking Freight/Courier Services
KO,Coca-Cola Company (The) Common Stock,$54.35,-0.28,-0.513%,234608226508.00,United States,,14384771,Consumer Non-Durables,Beverages (Production/Distribution)
KODK,Eastman Kodak Company Common New,$7.05,-0.16,-2.219%,553944268.00,United States,,2263722,Miscellaneous,Business Services
KOF,Coca Cola Femsa S.A.B. de C.V.  American Depositary Shares each representing 10 Units (each Unit consists of 3 Series B Shares and 5 Series L Shares),$53.69,-0.75,-1.378%,11279368404.00,Mexico,1993,147992,Consumer Non-Durables,Beverages (Production/Distribution)
KOP,Koppers Holdings Inc. Koppers Holdings Inc. Common Stock,$34.79,0.18,0.52%,742396543.00,United States,2006,117088,Basic Industries,Industrial Specialties
KORE,KORE Group Holdings Inc. Common Stock,$6.55,0.19,2.987%,472438623.00,,,308978,,
KOS,Kosmos Energy Ltd. Common Shares (DE),$3.97,-0.14,-3.406%,1792850162.00,Bermuda,2011,8122097,Energy,Oil & Gas Production
KR,Kroger Company (The) Common Stock,$39.30,-0.02,-0.051%,29224992618.00,United States,,3970136,Consumer Services,Food Chains
KRA,Kraton Corporation Common Stock,$45.55,-0.07,-0.153%,1464347595.00,United States,2009,149535,Basic Industries,Major Chemicals
KRC,Kilroy Realty Corporation Common Stock,$69.47,-0.67,-0.955%,8090073969.00,United States,1997,553374,Consumer Services,Real Estate Investment Trusts
KREF,KKR Real Estate Finance Trust Inc. Common Stock,$22.52,0.06,0.267%,1252956050.00,United States,2017,261362,Consumer Services,Real Estate Investment Trusts
